{
  "$schema": "http://json-schema.org/draft-04/schema#",
  "type": "object",
  "properties": {
    "type": {
      "type": "string"
    },
    "query": {
      "type": "string"
    },
    "queryParameters": {
      "type": "string"
    },
    "queryParametersObj": {
      "type": "object",
      "properties": {
        "sortBy": {
          "type": "string"
        },
        "isGeo": {
          "type": "integer"
        },
        "hId": {
          "type": "string"
        },
        "placeId": {
          "type": "string"
        },
        "types": {
          "type": "array",
          "items": {}
        }
      },
      "required": [
        "sortBy",
        "isGeo",
        "hId",
        "placeId",
        "types"
      ]
    },
    "isCountry": {
      "type": "boolean"
    }
  },
  "required": [
    "type",
    "query",
    "queryParameters",
    "queryParametersObj",
    "isCountry"
  ]
}
