{"queryParameters":"sortBy=distanceScore&isGeo=1&hId=&placeId=ChIJD7fiBh9u5kcRYJSMaMOCCwQ&types=","isCountry":false,"query":"paris\/24-08-2019\/31-08-2019\/2_adult,1_child,3_age\/3_adult","queryParametersObj":{"hId":"","types":[],"placeId":"ChIJD7fiBh9u5kcRYJSMaMOCCwQ","sortBy":"distanceScore","isGeo":1},"type":"hotel"}